{
  "generatedAt": "2026-01-24T15:01:19.022Z",
  "source": "kudosprime.com",
  "game": "fh5",
  "items": [
    {
      "id": "1",
      "url": "https://www.kudosprime.com/fh5/car_sheet.php?id=1",
      "identity": {
        "year": "2001",
        "make": "Acura",
        "model": null
      },
      "specs": {
        "defaultPI": 596,
        "piClass": "C",
        "driveType": "FWD",
        "weightLbs": 2638.9,
        "weightDistribution": null
      },
      "rawTextSample": "Forza Motorsport\nF7\nF6\nF5\nF4\nF3\nF. Horizon 5\nFH4\nFH3\nFH2\nFH\nGran Turismo 7\nGTS\nGT6\nGT5\nNFS MW\nGTA 5\nNot connected\nSign in\nNew account\nDiscover more\ngames\nForza\ncar\nCar\nFH4\nMazda RX-7\nfh3\nForza Horizon 3\nMazda MX-5\nAudi\nContact\nhome\nmap250 Boards\ndrive_etaCars\nstarsPerks\ntrending_upStats\npublicExport\nsearch\ndrive_eta\nKudosprime // FH5 Car Database // Acura\n\n 2001 Acura\n\nIntegra Type-R\n\nadd_a_photo\nAdd your own FH5 photo(s) for this car.\n\nAcura Integra\n\nAlternate Name(s)\n\nOther Acura cars\n2017 NSX\n2002 RSX Type-S\nIf you want to contact me about Forza Horizon 5 on K', you can use the Contact button on top of the current page. Milouse\n \n25,000 Cr\nRETRO HOT HATCH\nC\n596\ncall_made\nS2\n922\nMAX\n145kW FWD 1197Kg 0.121kW/Kg -10.1%\n\nAutoshow & Wheelspin\n5.6SPEED+0.2\n4.6HANDLING+0.4\n3.9ACCELERATION-0.4\n3.1LAUNCH-0.6\n3.4BRAKING\n5.4OFFROAD-0.6\n\nTop Speed:250.2 Kph+5.1% Lat. G @97 Kph:0.90+3.4%\n\n0 to...97 Kph:6.216 s-2.1% 161 Kph:14.716 s-8.2%\n\nLateral G@97 Kph:0.90+3.4%\n\nData compared to 29 cars from PI 586 to PI 606\n\nCar data contributors: jxm040 walslayer Milouse FH5GAMER Oween\nLink to this car in all Forza games since 2009:\nFM\tFH5\tFH4\tF7\tFH3\tF6\tFH2XO\tF5\tFH\tF4\tF3\n10\t1\t85\t566\t182\t6\t257\t3\t-\t86\t96\n\nCar Masteries\n\nList cars having the exact same Car Mastery grid (non-exhaustive)\n20\n5 p\n20\n5 p\n20\n5 p\n20\n5 p\n10\n3 p\n15\n3 p\n1.5\n3 p\n20\n3 p\n25 p\n5\n1 p\n0.5\n1 p\n2000\n1 p\n+20 % XP for the next 10 street races\n5 sp\nDaredevil Skill Score: +20 %\n5 sp\n+20 % XP from banked Skills in Freeroam\n5 sp\nDrift and E-Drift Skill Score: +20 %\n5 sp\nInstant 10 Forza Points\n3 sp\nPermanent +15 % in Event Finish XP\n3 sp\nSkill Multiplier built 1.5 times faster during Skill Songs\n3 sp\nHead-to-Head Credits: +20 %\n3 sp\nThe first collision doesn't break the current Skill Chain\n25 sp\nPass Skill Score: +5 %\n1 sp\nSkill Chains ends 0.5 second later\n1 sp\nInstant 2000 XP\n1 sp\n You need to be connected to post comment\nmessage #2 | Sunday September 04, 2022 | RageMix  | Report\nPass Skill Score +5% changes to Extra 5% XP for 10 Drag Racing Events.\n \nDiscover more\ngames\nForza Horizon\ncar\nGran Turismo\nFH5\nHorizon 5\nMazda RX-7\nfh3\nCar\nFH3\nDiscover more\ngames\nHorizon 5\nfh5\nForza Horizon\ncar\nCar dealership\nMX-5 Miata\nMazda RX-7\nMX-5\nCARS\nCopyright 2010-2026 KudosPrime.com. \"Forza Motorsport\" is a trademark of Microsoft    u(0.0001) a(0.0199) m(941K) l(2592000) 2fr - Privacy Policy\n\nhelper text"
    },
    {
      "id": "2",
      "url": "https://www.kudosprime.com/fh5/car_sheet.php?id=2",
      "identity": {
        "year": "2002",
        "make": "Acura",
        "model": null
      },
      "specs": {
        "defaultPI": 585,
        "piClass": "C",
        "driveType": "FWD",
        "weightLbs": 2819.7,
        "weightDistribution": null
      },
      "rawTextSample": "Forza Motorsport\nF7\nF6\nF5\nF4\nF3\nF. Horizon 5\nFH4\nFH3\nFH2\nFH\nGran Turismo 7\nGTS\nGT6\nGT5\nNFS MW\nGTA 5\nNot connected\nSign in\nNew account\nDiscover more\nVideo Games\nRacing Video Games\nCars, Trucks & SUVs\ngames\nAudi\nGames\nXbox\nSports Cars\nVehicle Simulators\nContact\nhome\nmap250 Boards\ndrive_etaCars\nstarsPerks\ntrending_upStats\npublicExport\nsearch\ndrive_eta\nKudosprime // FH5 Car Database // Acura\n\n 2002 Acura\n\nRSX Type-S\n\nadd_a_photo\nAdd your own FH5 photo(s) for this car.\n\nAcura RSX\n\nAlternate Name(s)\n\nOther Acura cars\n2017 NSX\n2001 Integra Type-R\nIf you want to contact me about Forza Horizon 5 on K', you can use the Contact button on top of the current page. Milouse\n \n25,000 Cr\nRETRO HOT HATCH\nC\n585\ncall_made\nS2\n906\nMAX\n149kW FWD 1279Kg 0.116kW/Kg -12.4%\n\nAutoshow & Wheelspin\n5.6SPEED+0.3\n4.7HANDLING+0.4\n3.9ACCELERATION-0.3\n3.0LAUNCH-0.6\n3.5BRAKING+0.2\n5.6OFFROAD-0.3\n\nTop Speed:238.8 Kph+2.1% Lat. G @97 Kph:0.90+3.4%\n\n0 to...97 Kph:6.717 s+5.8% 161 Kph:18.019 s+9.7%\n\nLateral G@97 Kph:0.90+3.4%\n\nData compared to 28 cars from PI 575 to PI 595\n\nCar data contributors: jxm040 walslayer Milouse MarkinoVak KZ Pluto\nLink to this car in all Forza games since 2009:\nFM\tFH5\tFH4\tF7\tFH3\tF6\tFH2XO\tF5\tFH\tF4\tF3\n-\t2\t264\t342\t172\t5\t153\t2\t-\t83\t57\n\nCar Masteries\n\nList cars having the exact same Car Mastery grid (non-exhaustive)\n20\n5 p\n20\n5 p\n20\n5 p\n20\n5 p\n10\n3 p\n15\n3 p\n1.5\n3 p\n20\n3 p\n25 p\n5\n1 p\n0.5\n1 p\n2000\n1 p\n+20 % XP for the next 10 street races\n5 sp\nDaredevil Skill Score: +20 %\n5 sp\n+20 % XP from banked Skills in Freeroam\n5 sp\nDrift and E-Drift Skill Score: +20 %\n5 sp\nInstant 10 Forza Points\n3 sp\nPermanent +15 % in Event Finish XP\n3 sp\nSkill Multiplier built 1.5 times faster during Skill Songs\n3 sp\nHead-to-Head Credits: +20 %\n3 sp\nThe first collision doesn't break the current Skill Chain\n25 sp\nPass Skill Score: +5 %\n1 sp\nSkill Chains ends 0.5 second later\n1 sp\nInstant 2000 XP\n1 sp\n You need to be connected to post comment\nmessage #2 | Sunday September 04, 2022 | RageMix  | Report\nPass Skill Score +5% changes to Extra 5% XP for 10 Drag Racing Events.\n \nDiscover more\ngames\nForza Horizon 5\nMX-5 Miata\nVideo game\nGran Turismo\nCar dealership\nFH4\nMazda MX-5\nfh4\nfh5\nDiscover more\ngames\nFH4\nForza Horizon\nGran Turismo\nCar dealership\ncars\nMazda MX-5\nForza Horizon 3\nHorizon 5\nCopyright 2010-2026 KudosPrime.com. \"Forza Motorsport\" is a trademark of Microsoft    u(0.0001) a(0.0248) m(955K) l(2592000) 2fr - Privacy Policy\n\nhelper text"
    },
    {
      "id": "3",
      "url": "https://www.kudosprime.com/fh5/car_sheet.php?id=3",
      "identity": {
        "year": "2017",
        "make": "Acura",
        "model": "Acura NSX"
      },
      "specs": {
        "defaultPI": 831,
        "piClass": "S1",
        "driveType": "AWD",
        "weightLbs": 3803,
        "weightDistribution": null
      },
      "rawTextSample": "Forza Motorsport\nF7\nF6\nF5\nF4\nF3\nF. Horizon 5\nFH4\nFH3\nFH2\nFH\nGran Turismo 7\nGTS\nGT6\nGT5\nNFS MW\nGTA 5\nNot connected\nSign in\nNew account\nContact\nhome\nmap250 Boards\ndrive_etaCars\nstarsPerks\ntrending_upStats\npublicExport\nsearch\ndrive_eta\nKudosprime // FH5 Car Database // Acura\n\n 2017 Acura\n\nNSX\n\nadd_a_photo\nAdd your own FH5 photo(s) for this car.\n\nAcura NSX '17\n\nAlternate Name(s)\n\nOther Acura cars\n2002 RSX Type-S\n2001 Integra Type-R\nIf you want to contact me about Forza Horizon 5 on K', you can use the Contact button on top of the current page. Milouse\n \n170,000 Cr\nMODERN SUPERCARS\nS1\n831\ncall_made\nS2\n959\nMAX\n427kW AWD 1725Kg 0.248kW/Kg -34%\n\nAutoshow & Wheelspin\n7.0SPEED-0.1\n6.3HANDLING+0.3\n9.2ACCELERATION+2.7\n10LAUNCH+3.8\n7.1BRAKING+0.9\n5.3OFFROAD+0.2\n\nTop Speed:311.2 Kph-1.1% Lat. G @97 Kph:1.10-0.9%\n\n0 to...97 Kph:2.700 s-21.6% 161 Kph:6.400 s-7.7%\n\nLateral G@97 Kph:1.10-0.9%\n\nData compared to 46 cars from PI 821 to PI 841\n\nCar data contributors: Milouse TitanNidoking MarkinoVak KZ Pluto Oween\nLink to this car in all Forza games since 2009:\nFM\tFH5\tFH4\tF7\tFH3\tF6\tFH2XO\tF5\tFH\tF4\tF3\n245\t3\t358\t375\t415\t-\t-\t-\t-\t-\t-\n\nCar Masteries\n\nList cars having the exact same Car Mastery grid (non-exhaustive)\n15\n10 p\n25\n10 p\n10000\n10 p\n20\n5 p\n20\n5 p\n20\n5 p\n15\n3 p\n15\n3 p\n15\n3 p\n15\n3 p\n25 p\n10\n1 p\n10\n1 p\n25000\n1 p\nInstant 15 Forza Points\n10 sp\nSpeed Skill Score: +25 %\n10 sp\nInstant 10000 XP\n10 sp\n+20 % XP from banked Skills in Freeroam\n5 sp\nTriple Pass Combo Skill Score: +20 %\n5 sp\nDaredevil Skill Score: +20 %\n5 sp\nPermanent +15 % in Event Finish XP\n3 sp\nSlingshot Skill Score: +15 %\n3 sp\nClean Racing Skill Score: +15 %\n3 sp\nDrafting Skill Score: +15 %\n3 sp\nThe first collision doesn't break the current Skill Chain\n25 sp\nLucky Escape Skill Score: +10 %\n1 sp\nHead-to-Head Credits: +10 %\n1 sp\nInstant 25000 Credits\n1 sp\n You need to be connected to post comment\n \nCopyright 2010-2026 KudosPrime.com. \"Forza Motorsport\" is a trademark of Microsoft    u(0.0001) a(0.0166) m(937K) l(2592000) 2fr - Privacy Policy\n\nhelper text"
    },
    {
      "id": "4",
      "url": "https://www.kudosprime.com/fh5/car_sheet.php?id=4",
      "identity": {
        "year": "1973",
        "make": "Alpine",
        "model": "Alpine A110"
      },
      "specs": {
        "defaultPI": 550,
        "piClass": "C",
        "driveType": "RWD",
        "weightLbs": 1576.3,
        "weightDistribution": null
      },
      "rawTextSample": "Good news : we're only using non intrusive, necessary cookies. Learn more\nGot it!\nForza Motorsport\nF7\nF6\nF5\nF4\nF3\nF. Horizon 5\nFH4\nFH3\nFH2\nFH\nGran Turismo 7\nGTS\nGT6\nGT5\nNFS MW\nGTA 5\nNot connected\nSign in\nNew account\nContact\nhome\nmap250 Boards\ndrive_etaCars\nstarsPerks\ntrending_upStats\npublicExport\nsearch\ndrive_eta\nKudosprime // FH5 Car Database // Alpine\n\n 1973 Alpine\n\nA110 1600s\n\nadd_a_photo\nAdd your own FH5 photo(s) for this car.\n\nAlpine A110 '73\n\nAlternate Name(s)\n\nOther Alpine cars\n2017 A110\nIf you want to contact me about Forza Horizon 5 on K', you can use the Contact button on top of the current page. Milouse\n \n98,000 Cr\nCLASSIC RALLY\nC\n550\ncall_made\nS2\n936\nMAX\n92kW RWD 715Kg 0.129kW/Kg -9.1%\n\nAutoshow & Wheelspin\n5.0SPEED-0.3\n4.1HANDLING+0.2\n4.1ACCELERATION+0.3\n3.1LAUNCH-0.1\n3.0BRAKING+0.2\n5.5OFFROAD-0.3\n\nTop Speed:222.0 Kph-5.6% Lat. G @97 Kph:0.84+2.4%\n\n0 to...97 Kph:6.974 s+5.7% 161 Kph:20.684 s+22.9%\n\nLateral G@97 Kph:0.84+2.4%\n\nData compared to 35 cars from PI 540 to PI 560\n\nCar data contributors: jxm040 walslayer Milouse MarkinoVak groenroos Oween\nLink to this car in all Forza games since 2009:\nFM\tFH5\tFH4\tF7\tFH3\tF6\tFH2XO\tF5\tFH\tF4\tF3\n-\t4\t-\t-\t-\t-\t-\t-\t-\t-\t-\n\nCar Masteries\n\nList cars having the exact same Car Mastery grid (non-exhaustive)\n25\n10 p\n20\n5 p\n20\n5 p\n20\n5 p\n10\n3 p\n15\n3 p\n15\n3 p\n25 p\n10000\n1 p\n5\n1 p\n3000\n1 p\n+25 % XP for the next 10 road races\n10 sp\n+20 % XP for the next 10 Dirt Racing events\n5 sp\nCombo Skill Score: +20 %\n5 sp\nPass Skill Score: +20 %\n5 sp\nInstant 10 Forza Points\n3 sp\nSpeed Skill Score: +15 %\n3 sp\nAir Skill Score: +15 %\n3 sp\nThe first collision doesn't break the current Skill Chain\n25 sp\nInstant 10000 Credits\n1 sp\nPermanent +5 % in Event Finish XP\n1 sp\nInstant 3000 XP\n1 sp\n You need to be connected to post comment\nmessage #1 | Sunday September 04, 2022 | RageMix  | Report\n- Reduced Perk 1; From 4000 to 3000 XP.\n- Wheelspin changed to 10 FP\n\n \nCopyright 2010-2026 KudosPrime.com. \"Forza Motorsport\" is a trademark of Microsoft    u(0.0001) a(0.018) m(943K) l(2592000) 2fr - Privacy Policy\n\nhelper text"
    },
    {
      "id": "732",
      "url": "https://www.kudosprime.com/fh5/car_sheet.php?id=732",
      "identity": {
        "year": "1968",
        "make": "Abarth",
        "model": "Abarth 595"
      },
      "specs": {
        "defaultPI": 100,
        "piClass": "D",
        "driveType": "RWD",
        "weightLbs": 1256.6,
        "weightDistribution": null
      },
      "rawTextSample": "Forza Motorsport\nF7\nF6\nF5\nF4\nF3\nF. Horizon 5\nFH4\nFH3\nFH2\nFH\nGran Turismo 7\nGTS\nGT6\nGT5\nNFS MW\nGTA 5\nNot connected\nSign in\nNew account\nDiscover more\ngames\nMX-5 Miata\nFH3\nfh4\nGran Turismo\nfh3\nMazda MX-5\nCARS\ncar\nFH5\nContact\nhome\nmap250 Boards\ndrive_etaCars\nstarsPerks\ntrending_upStats\npublicExport\nsearch\ndrive_eta\nKudosprime // FH5 Car Database // Abarth\n\n 1968 Abarth\n\n595 Esseesse\n\nadd_a_photo\nAdd your own FH5 photo(s) for this car.\n\nAbarth 595 '68\n\nAlternate Name(s)\n\nOther Abarth cars\n2017 124 Spider\n2016 695 Biposto\n1980 Fiat 131\nIf you want to contact me about Forza Horizon 5 on K', you can use the Contact button on top of the current page. Milouse\n \n35,000 Cr\nCULT CARS\nD\n100\ncall_made\nS2\n949\nMAX\n21kW RWD 570Kg 0.037kW/Kg +15.4%\n\nAutoshow & Wheelspin\n2.6SPEED+0.2\n3.7HANDLING+0.4\n1.7ACCELERATION+0.2\n2.6LAUNCH\n2.0BRAKING-0.2\n5.1OFFROAD-1\n\nTop Speed:118.9 Kph+7.7% Lat. G @97 Kph:0.73+4.3%\n\n0 to...97 Kph:28.227 s-0.5% 161 Kph:??? s\n\nLateral G@97 Kph:0.73+4.3%\n\nData compared to 18 cars from PI 100 to PI 110\n\nCar data contributors: Milouse FH5GAMER Fred-104 Oween\nLink to this car in all Forza games since 2009:\nFM\tFH5\tFH4\tF7\tFH3\tF6\tFH2XO\tF5\tFH\tF4\tF3\n-\t732\t249\t216\t148\t4\t206\t-\t1\t-\t-\n\nCar Masteries\n\nList cars having the exact same Car Mastery grid (non-exhaustive)\n20\n5 p\n20\n5 p\n5\n3 p\n15\n3 p\n5\n3 p\n25 p\n1.25\n1 p\n10\n1 p\n2000\n1 p\nClean Racing Skill Score: +20 %\n5 sp\n+20 % XP for the next 10 road races\n5 sp\nInstant 5 Forza Points\n3 sp\n+15 % XP from banked Skills in Freeroam\n3 sp\nIn convoy: +5 % XP from Skills\n3 sp\nThe first collision doesn't break the current Skill Chain\n25 sp\nSkill Multiplier built 1.25 times faster during Skill Songs\n1 sp\nHead-to-Head Credits: +10 %\n1 sp\nInstant 2000 XP\n1 sp\n You need to be connected to post comment\nmessage #1 | Tuesday July 02, 2024 | u1719898042424  | Report\nths mana sas\n\n \nDiscover more\ngames\nForza\nRX-7\nForza Motorsport\nMazda MX-5\nForza Horizon 4\nFH5\nForza Horizon 3\ncars\nGran Turismo\nDiscover more\ngames\nForza Motorsport\nCARS\nForza Horizon\nfh4\nRX-7\ncars\ncar\nForza Horizon 5\nFH4\nCopyright 2010-2026 KudosPrime.com. \"Forza Motorsport\" is a trademark of Microsoft    u(0) a(0.0165) m(945K) l(2592000) 2fr - Privacy Policy\n\nhelper text"
    }
  ],
  "verifiedSpecsByKey": {
    "2001-acura-null": {
      "sourceUrl": "https://www.kudosprime.com/fh5/car_sheet.php?id=1",
      "defaultPI": 596,
      "driveType": "FWD",
      "weightLbs": 2638.9,
      "weightDistribution": null
    },
    "2002-acura-null": {
      "sourceUrl": "https://www.kudosprime.com/fh5/car_sheet.php?id=2",
      "defaultPI": 585,
      "driveType": "FWD",
      "weightLbs": 2819.7,
      "weightDistribution": null
    },
    "2017-acura-acura-nsx": {
      "sourceUrl": "https://www.kudosprime.com/fh5/car_sheet.php?id=3",
      "defaultPI": 831,
      "driveType": "AWD",
      "weightLbs": 3803,
      "weightDistribution": null
    },
    "1973-alpine-alpine-a110": {
      "sourceUrl": "https://www.kudosprime.com/fh5/car_sheet.php?id=4",
      "defaultPI": 550,
      "driveType": "RWD",
      "weightLbs": 1576.3,
      "weightDistribution": null
    },
    "1968-abarth-abarth-595": {
      "sourceUrl": "https://www.kudosprime.com/fh5/car_sheet.php?id=732",
      "defaultPI": 100,
      "driveType": "RWD",
      "weightLbs": 1256.6,
      "weightDistribution": null
    }
  },
  "errors": []
}